{
  "$schema": "https://json-schema.org/draft/2020-12/schema",
  "title": "Changed Artifact Plus Implementation Notes",
  "type": "object",
  "additionalProperties": false,
  "required": [
    "changed_artifacts",
    "slice",
    "test_first_proof",
    "implementation_notes",
    "validation",
    "risks",
    "rollback",
    "next_action"
  ],
  "properties": {
    "changed_artifacts": {
      "type": "array",
      "minItems": 1,
      "items": {"type": "string", "minLength": 1}
    },
    "slice": {"type": "string", "minLength": 1},
    "test_first_proof": {
      "type": "object",
      "additionalProperties": false,
      "required": ["red", "green"],
      "properties": {
        "red": {"type": "string", "minLength": 1},
        "green": {"type": "string", "minLength": 1}
      }
    },
    "implementation_notes": {
      "type": "array",
      "minItems": 1,
      "items": {"type": "string", "minLength": 1}
    },
    "validation": {
      "type": "array",
      "minItems": 1,
      "items": {"type": "string", "minLength": 1}
    },
    "risks": {
      "type": "array",
      "items": {"type": "string"}
    },
    "rollback": {
      "type": "array",
      "minItems": 1,
      "items": {"type": "string", "minLength": 1}
    },
    "next_action": {"type": "string", "minLength": 1}
  }
}
